{
  "$schema": "https://json-schema.org/draft/2020-12/schema",
  "$id": "https://local.books/schemas/recon-period.schema.json",
  "title": "Bookkeeping Reconciliation Period",
  "type": "object",
  "additionalProperties": false,
  "required": [
    "schema_version",
    "company_slug",
    "period",
    "generated_at",
    "approve_for_build",
    "checks",
    "exceptions"
  ],
  "properties": {
    "schema_version": {
      "const": "1.0"
    },
    "company_slug": {
      "type": "string",
      "pattern": "^[a-z0-9-]+$"
    },
    "period": {
      "type": "string",
      "pattern": "^[0-9]{4}-[0-9]{2}$"
    },
    "generated_at": {
      "type": "string",
      "format": "date-time"
    },
    "currency": {
      "type": [
        "string",
        "null"
      ],
      "pattern": "^[A-Z]{3}$"
    },
    "approve_for_build": {
      "type": "boolean"
    },
    "blocking_issue_count": {
      "type": "integer",
      "minimum": 0
    },
    "checks": {
      "type": "array",
      "items": {
        "$ref": "#/$defs/check"
      }
    },
    "exceptions": {
      "type": "array",
      "items": {
        "$ref": "#/$defs/exception"
      }
    },
    "notes": {
      "type": "array",
      "items": {
        "type": "string"
      }
    }
  },
  "$defs": {
    "artifact_ref": {
      "type": "object",
      "additionalProperties": false,
      "required": [
        "artifact_path"
      ],
      "properties": {
        "artifact_path": {
          "type": "string",
          "minLength": 1
        },
        "record_refs": {
          "type": "array",
          "items": {
            "type": "string"
          }
        },
        "notes": {
          "type": [
            "string",
            "null"
          ]
        }
      }
    },
    "check": {
      "type": "object",
      "additionalProperties": false,
      "required": [
        "check_id",
        "name",
        "status"
      ],
      "properties": {
        "check_id": {
          "type": "string",
          "minLength": 1
        },
        "name": {
          "type": "string",
          "minLength": 1
        },
        "status": {
          "type": "string",
          "enum": [
            "pass",
            "warn",
            "fail",
            "skipped"
          ]
        },
        "lhs_label": {
          "type": [
            "string",
            "null"
          ]
        },
        "lhs_amount": {
          "type": [
            "number",
            "null"
          ]
        },
        "rhs_label": {
          "type": [
            "string",
            "null"
          ]
        },
        "rhs_amount": {
          "type": [
            "number",
            "null"
          ]
        },
        "delta": {
          "type": [
            "number",
            "null"
          ]
        },
        "threshold": {
          "type": [
            "number",
            "null"
          ]
        },
        "notes": {
          "type": "array",
          "items": {
            "type": "string"
          }
        },
        "evidence_refs": {
          "type": "array",
          "items": {
            "$ref": "#/$defs/artifact_ref"
          }
        }
      }
    },
    "exception": {
      "type": "object",
      "additionalProperties": false,
      "required": [
        "exception_id",
        "severity",
        "summary"
      ],
      "properties": {
        "exception_id": {
          "type": "string",
          "minLength": 1
        },
        "severity": {
          "type": "string",
          "enum": [
            "info",
            "warn",
            "error"
          ]
        },
        "summary": {
          "type": "string",
          "minLength": 1
        },
        "blocking": {
          "type": "boolean"
        },
        "artifact_refs": {
          "type": "array",
          "items": {
            "$ref": "#/$defs/artifact_ref"
          }
        },
        "recommended_action": {
          "type": [
            "string",
            "null"
          ]
        }
      }
    }
  }
}
